name,full_page_wiki_url,image_url,image_filename,description
Abbadomon,https://wikimon.net/Abbadomon,https://wikimon.net/File:Abbadomon.jpg,Abbadomon.jpg,"a mysterious digimon that evolved enormously by absorbing the negative data that the network is overflowing with beyond its limit. its raison d'etre is to transcend good and evil, and return everything to nothingness. it bites into digimon and the digital world itself with the large mouth at its center and the mouths on its numerous tentacles, and after doing so, only empty, blank data is left behind. the birth of abbadomon is undoubtedly a crisis for the entire digital world, and it is conjectured that some digital worlds from other dimensions have been annihilated by it.its special moves are firing cursed beams from all of the eyes on its tentacles (gaze eraser), seizing the enemy with its tentacles and swallowing them whole with its central mouth (gala-lightness), and additionally, firing a white beam from that mouth (white liner); you will be erased the instant you suffer any of these techniques."
Abbadomon_Core,https://wikimon.net/Abbadomon_Core,https://wikimon.net/File:Abbadomon_core.jpg,Abbadomon_core.jpg,"the main body that exists within abbadomon, it is its true form. it seeks nothingness, prefers nothingness, and rejects everything except nothingness. after it turns everything into nothingness, it disappears itself, fulfilling its purpose.its special move is making the energy that it shoots from both of its hands stick to the enemy, corroding them, and gnawing away at their whole body (eclipse none). in addition, it has ""bingerard"", in which it transforms its right arm into a spear and pierces with it, and ""death charge"", in which it transforms its left arm into a gun barrel and fires energy shots. also, its ""gaze eraser"", cursed beams fired from all of the eyes on its cape, is even more cursed than when it is performed by abbadomon."
Achillesmon,https://wikimon.net/Achillesmon,https://wikimon.net/File:Achillesmon.jpg,Achillesmon.jpg,"an ultimate digimon that evolved by becoming adept in every kind of sport from all times and places, and mastering them. it possesses heart, technique, and physique, and is a true seeker that is always training, and never boasts about its tenacious power. its extreme physical ability has no weaknesses, and so it achieves victory without leaving any openings, not only in sports, but also in battle.the shields on its feet act as boosters, and are widely used for things such as its ""anemodarmenos"", where it confuses the enemy with afterimages caused by its high-speed movement, and ""asteroeidis"", a kicking technique that it dishes out using its swift speed. its special move is throwing its divine spear and ensuring that it pierces the enemy's digicore (lonkhe adistakto)."
Aegiochusmon,https://wikimon.net/Aegiochusmon,https://wikimon.net/File:Aegiochusmon.jpg,Aegiochusmon.jpg,"a god man digimon which synthesized the abilities of various species, using a humanoid body as a base. this synthesis of species is said to have resulted from the pursuit of the ultimate state, or omnipotence, dramatically altering its appearance to match its surroundings. this form is composed of data taken from the dragon-species, so the dragon-species data lying dormant within its body manifests on the surface of its body, centered upon the crystal in its chest, and establishes itself as armor. this armor is a powered suit that affects not only aegiochusmon's defensive power but also its physical strength, drastically increasing its offensive power. its special moves are commencing a rush attack with fists shrouded in the thunder produced from its horn (bolt break knockdown), and shaping thunder into a pile, then impaling the opponent from just overhead to drive them into the ground (lightning pile). it is said that if the pile of ""lightning pile"" pierces the opponent once, the piles cast afterward will always hit, regardless from where they're cast. also, it has a technique called ""charging strike"" which pierces the opponent's head with its horn using a high speed charge that capitalizes on its prided leg strength."
Aegiochusmon:_Blue,https://wikimon.net/Aegiochusmon:_Blue,https://wikimon.net/File:Aegiochusmon_blue2.jpg,Aegiochusmon_blue2.jpg,"a god man digimon which synthesized the abilities of various species, using a humanoid body as a base. this synthesis of species is said to have resulted from the pursuit of the ultimate state, or omnipotence, dramatically altering its appearance to match its surroundings. this form is composed of data taken from the cyborg-species, so the cyborg-species data lying dormant within its body focuses itself on its upper body, particularly its left side, centered upon the crystal in its chest. it is equipped with a release for the characteristic power of the cyborg-species, and a lock-on function which doesn't miss its designated target. its gigantic left arm, the ""mechanization powered arm"", has the ability to attach and detach, and is able to independently pursue and attack a locked opponent. its special moves are firing a beam from the fingertips of the ""mechanization powered arm"" (penetra-laser), and flying and slashing the opponent with the wings equipped to its back (wing cutter). furthermore, it can charge energy in the palm of the ""mechanization powered arm"" while it's still attached, then release it in a charge at the enemy (powered ignition)."
Aegiochusmon:_Dark,https://wikimon.net/Aegiochusmon:_Dark,https://wikimon.net/File:Aegiochusmon_dark.jpg,Aegiochusmon_dark.jpg,"a god man digimon which synthesized the abilities of various species, using a humanoid body as a base. this synthesis of species is said to have resulted from the pursuit of the ultimate state, or omnipotence, dramatically altering its appearance to match its surroundings.because this form is composed of data taken from the evil-species, the evil-species data that lay dormant in its body has spread over its entire body, centered upon the crystal in its chest. the malevolence of the evil-species has flooded its body and soul, and it regards all those it sees to be its prey and hunts down its enemies. the red electric shocks emanating from its body hide viruses, and it could be said that it is a special digimon that generates viruses in spite of being a digimon of the vaccine attribute. the technique where it transmits viruses into the wounds of the enemy it has dealt damage to, undermining it from the inside, is completely menacing. its special moves are ""triangler"", wherein it chops up the enemy with its three scythes, ""plasmadness"", wherein it gathers dark electric shocks on both of its hands and showers the foe with them, and ""death dinner"", wherein it mounts the opponent and instinctively preys upon it.  video games"
Aegiochusmon:_Green,https://wikimon.net/Aegiochusmon:_Green,https://wikimon.net/File:Aegiochusmon_green.jpg,Aegiochusmon_green.jpg,"a god man digimon which synthesized the abilities of various species, using a humanoid body as a base. this synthesis of species is said to have resulted from the pursuit of the ultimate state, or omnipotence, dramatically altering its appearance to match its surroundings. this form is composed of data taken from the plant-species, so the plant-species lying dormant within its body establishes itself as an upper body and arms, centered upon the crystal in its chest. because it is based on the plant-species, its weight is especially light compared to the other forms. it is able to fire sturdy thorns from the busters equipped to both of its arms, and perform tricky movements that hook its thorns in various places similar to rope action, or perform others that are used for offense and defense. its keen movements which capitalize on its equipment and agility can definitely be said to be this form's greatest distinction. its special moves are summoning thorns transformed into an evil spirit, which snaps at the opponent (bramble bite), and shooting numerous thorns from its entire body, tearing the surrounding opponents to pieces over a wide range (plant zone cradle). also, as a standard move, it has a technique called ""charging strike"" which pierces the opponent's head with its horn using a high speed charge that capitalizes on its legs."
Aegiochusmon:_Holy,https://wikimon.net/Aegiochusmon:_Holy,https://wikimon.net/File:Aegiochusmon_holly.jpg,Aegiochusmon_holly.jpg,"a god man digimon which synthesized the abilities of various species, using a humanoid body as a base. this synthesis of species is said to have resulted from the pursuit of the ultimate state, or omnipotence, dramatically altering its appearance to match its surroundings. this form is composed of data taken from the holy-species, so the holy-species data lying dormant within it envelops its entire body, centered upon the crystal in its chest, resulting in a clear heart as serene as a still lake. through the shields equipped on its arms, it is able to freely transform the powerful vaccines that overflow from its body into weapons such as daggers, or even defensive walls that prevent any kinds of viruses or data from passing through.its special moves are striking the enemy by causing countless daggers to rain down upon them from above (lightning shower), and combining its daggers with lightning to create a whip-like trail which it uses to slice enemies apart (thunder slash). not only that, by expanding its impregnable defensive walls (circlet defense), it is able to counter the opponent's attacks by deflecting them, while adding electric sparks to the deflected attacks."
Aegiomon,https://wikimon.net/Aegiomon,https://wikimon.net/File:Aegiomon2.jpg,Aegiomon2.jpg,"a god man digimon that has an appearance fusing the lower body of a goat with the upper body of a human. as a member of the same musical troupe as sirenmon, it is usually playing the pipes called ""syrinx"" hung at its waist and enjoying the music. although it has a peace-loving personality and doesn't really like to fight, the power it conceals within is unquantified, and when aegiomon fights to protect something, it exhibits unique talent for combat. it is said that by playing the ""attract echo"", which attracts the attention of those who hear it, on the syrinx it possesses, aegiomon snatches away the sense of self of those who continue to listen to its sound, and blinds them to everything but its figure. with this, it can produce an opportunity for other digimon to flee, or a chance for them to pursue. its special moves are hurling a sharp, backwards kick with its prided goat legs (iron trust), and beating the opponent while releasing the electricity circulating within its body from a portion of its arms, numbing the opponent's sensitivity and dulling their movements (stun beat blow)."
Aegisdramon,https://wikimon.net/Aegisdramon,https://wikimon.net/File:Ageisdramon.jpg,Ageisdramon.jpg,"a cyborg digimon born from the fusion of a plesiomon with seadramon-species data. it is said that its shining armor, made of gold digizoid, will purify all evil. it is a member of the crack team, and is mainly in charge of analyzing information on the enemy and reconnaissance. it is also known as the brains of the crack team due to the fact that the analyzed information is quickly sent to the crack team deployed to its surroundings, allowing them to keep the upper hand in combat situations. in addition, it has enough firepower to wipe out a whole battalion, even when acting alone. its special moves are firing gigantic shots of water from both its arms (power water), shooting down an enemy it has locked onto with missiles launched from its deck (blaze power), and crushing the opponent with a water current spewed out from its mouth (tera hydro breath). also, it has ""shine breaker"", wherein it simultaneously fires a large quantity of missiles enough to cover the sky, and charges upon the enemy at its maximum output.  current original"
Aero_V-dramon,https://wikimon.net/Aero_V-dramon,https://wikimon.net/File:Aerovdramon.jpg,Aerovdramon.jpg,"v-dramon evolved further, and as aero v-dramon, it became able to move through the sky. among the rare species of v-dramon, it is said that only veteran warriors that have come through numerous battles are able to evolve, so its existence is already becoming a legend. not only did its evolution grant it wings, but it also evolved several parts of its body for better grappling, acquiring stronger offensive and defensive power. if you include its attacks from the sky, there are probably no longer any opponents who can rival aero v-dramon. its special moves are forming a v-shaped energy substance that seems to connect the horn on its snout to the edges of its wings, then soaring towards the opponent (v-wing blade), and launching a shock wave which has the appearance of a dragon (dragon impulse). although ""v wing blade"" is a technique that cuts the opponent to pieces with the blades of its wings, its weakness is that it cannot be used if it is not in flight.  digimon life virtual pets video games"
Agnimon,https://wikimon.net/Agnimon,https://wikimon.net/File:Agnimon3.jpg,Agnimon3.jpg,"a digimon that possesses power over flame which bears the might of one of the legendary warrior ten. because its ""digicore"" is wrapped in the spiritual fire which is called a holy blaze, it is able to freely manipulate flames. it is an incarnation of the ""firewall"" that defends the net, and is also a guardian deity. because of its easily fired-up personality, it has a soldier-like aspect that practices mental training with yoga exercises, and its way of speaking is somewhat archaic, like a kenpo artist. in battle, it fights by freely using oriental martial arts, and accumulates flames at one point of its body with a trick that focuses its spirit, to raise its offensive ability. its special moves are unleashing a blazing dragon from its flame-clad fist (burning salamander), and unleashing a whirlwind kick of flames (salamander break).  digimon life"
Agumon,https://wikimon.net/Agumon,https://wikimon.net/File:Agumon.jpg,Agumon.jpg,"a reptile digimon with an appearance resembling a small dinosaur, it has grown and become able to walk on two legs. its strength is weak as it is still in the process of growing, but it has a fearless and rather ferocious personality. hard, sharp claws grow from both its hands and feet, and their power is displayed in battle. it also foreshadows an evolution into a great and powerful digimon. its special move is spitting a fiery breath from its mouth to attack the opponent (baby flame).  digimon life  video games virtual pets misc"
Agumon_(Black),https://wikimon.net/Agumon_(Black),https://wikimon.net/File:Agumon_black.jpg,Agumon_black.jpg,"a reptile digimon which has grown up and become able to walk on two legs, it has an appearance like a tiny dinosaur. because it is still on the way to adulthood, its power is low, but as its personality is quite ferocious, it doesn't understand fear. it has grown hard, sharp claws on its hands and feet, and demonstrates its power in battle. it is also a being that foretells evolution to a great and powerful digimon. its special move is spitting flame breath from its mouth to attack the opponent (baby flame).  video games"
Agumon_(X-Antibody),https://wikimon.net/Agumon_(X-Antibody),https://wikimon.net/File:Agumonx2.jpg,Agumonx2.jpg,"a reptile digimon which has grown up and become able to walk on two legs, it has an appearance like a tiny dinosaur. because it is still on the way to adulthood, its power is low, but as its personality is quite ferocious, it doesn't understand fear. it has grown hard, sharp claws on both its hands and feet, and demonstrates its power in battle. it is also a being that foretells evolution to a great and powerful digimon. its special move is spitting flame breath from its mouth to attack the opponent (baby flame).the effect on agumon's digicore due to the x-antibodyits qualities for evolving into a greymon-species, which are exceptionally outstanding as dinosaur-types, have improved, characteristic blue lines are visible in its body color, and it is no longer classified as a reptile-type, but rather as a dinosaur-type. its claws have sharpened, making them more lethal, and as a result of its ferocity being drawn out more strongly, it is now capable of firing its ""baby burner"", in which it amasses single shots of ""baby flame"" in its mouth and then spews it out all at once.  digimon life virtual pets misc"
Agumon_Hakase,https://wikimon.net/Agumon_Hakase,https://wikimon.net/File:Agumon_hakase.jpg,Agumon_hakase.jpg,"a genius agumon that has a doctorate in digital monster studies from digital world university. the badge on its chest is proof of its doctorate. though it is said that its degree was created by agumon hakase itself, it certainly is knowledgeable about digimon types and territories. due to its peculiar accent in which it attaches ""gya"" to the end of its remarks, it is thought to possibly have come from a distant locale. its special moves are to try to enchant itself with cleverness through its hat (hakase bou), and try to persuade the opponent with its rod (hakase bo).  digimon life virtual pets"
Airdramon,https://wikimon.net/Airdramon,https://wikimon.net/File:Airdramon.jpg,Airdramon.jpg,"a mythical beast digimon that grew gigantic wings. it's a highly valued monster due to it being said to have an existence close to that of a god. it specializes in mid-air attacks, its roar calls forth storms, and it causes giant tornadoes by flapping its wings. its personality is considerably brutal, but it has great intelligence. however, being employed by an ordinary tamer doesn't seem possible. its special move is flapping its enormous wings to send out a sharp vacuum blade, (spinning needle).  digimon life virtual pets"
Ajatarmon,https://wikimon.net/Ajatarmon,https://wikimon.net/File:Ajatarmon.jpg,Ajatarmon.jpg,"a plant digimon that lives in groups similar to tribes. it builds small civilizations deep in the jungle. generally speaking, they are taciturn and do not speak very much, and when hunting in groups, they contact each other through hand gestures and bring down their prey with excellent coordination. although it is short-tempered and has a violent disposition, it has a pure heart with pride as a hunter.its special moves are striking the enemy with an all-purpose hatchet that cuts down even large trees in an instant (assault hatchet), and restraining them with the tentacles growing from the back of its head (tied-up ivy). when facing opponents that attack from a distance, it counterattacks with its ""shotgun moss"", in which it shoots the poisonous grass needles that grow from its head like hair to restrict their movements."
Akatorimon,https://wikimon.net/Akatorimon,https://wikimon.net/File:Akatorimon.jpg,Akatorimon.jpg,"a cockatrimon-species digimon that developed its legs to make up for being unable to fly. because it consumes more energy than meets the eye moving its large body, it apparently detests violent battles. its special move is glaring with its red eyes to petrify and shatter the opponent (scar-red eye).  video games"
Aldamon,https://wikimon.net/Aldamon,https://wikimon.net/File:Aldamon.jpg,Aldamon.jpg,"a digimon that possesses power over flame that has transcended legend by inheriting all the might of one of the legendary warrior ten and acquiring unknown abilities. although it makes many enemies with its rough behavior, its name is derived from the fused form of a god of indian mythology, and since it possesses both the wildness of a beast and the intelligence of a human, it is a demon god that fights by converting anger or fear into righteous strength. in battle, it unleashes super-wide ranged attacks that melt everything then burn it up without a trace. this aspect has enough destructive power, in that moment, to bear a close resemblance to the menace of modern nuclear weapons. its special moves are enhancing the holy flames of its ""digicore"" to their utmost limit, then personally manufacturing the high temperature and high density core of the sun, before detonating it (brahmashira), and the high-speed rapid-firing of the extremely high-temperature shots it unleashes from the ""rudriya darpana"" superweapons on both of its arms (brahmastra).[n 1] also, it is capable of fighting using the rudriya darpana in hand-to-hand combat, and it specializes in close combat.  digimon life"
Algomon_(Adult),https://wikimon.net/Algomon_(Adult),https://wikimon.net/File:Algomon_adult.jpg,Algomon_adult.jpg,"a form of algomon that evolved to adult whose processing ability has increased abnormally. its power has also been strengthened, and it can lift up even large enemies with its hands, which have turned into industrial manipulators. its special moves are restraining the enemy with the tentacles that extend from its mouth (imprisonment), and sending an electric shock through them (volt line)."
Algomon_(Child),https://wikimon.net/Algomon_(Child),https://wikimon.net/File:Algomon_child.jpg,Algomon_child.jpg,"the child-evolved form of algomon. it watches over young algomon that are consuming data, and intercepts enemies when they draw near. it attacks with its ""brute knuckle"", where it curls up the tentacles on its arms into balls and punches with them, and ""imprisonment"", where it restrains the enemy with its loose tentacles."
Algomon_(Perfect),https://wikimon.net/Algomon_(Perfect),https://wikimon.net/File:Algomon.jpg,Algomon.jpg,"a digimon that was generated from a bug in an algorithm. due to its high-speed processing ability, it uses its countless ivy tendrils as tentacles, and takes complete control of a vast field. its special moves are using its tentacles to constrict the opponent's powers, completely restricting its movement (imprisonment), and an erasing beam fired from the eyes on its limbs (elimination line). also, when it takes control of a vast field it transforms into a parasite called ""worm phase"".  digimon life  current original"
Algomon_(Ultimate),https://wikimon.net/Algomon_(Ultimate),https://wikimon.net/File:Algomon_ultimate.jpg,Algomon_ultimate.jpg,"a gigantic ultimate digimon that evolved from the perfect-level algomon, and also amplified its close-combat abilities. its special moves are countless beams fired from its mouth (terabyte disaster), and beams destructive enough to completely distort even dimensions, fired from the eyes on its limbs (distortion line). in addition, its ""brute force"", which mows down the enemy with its massive body, is also exceptionally destructive."
Allomon,https://wikimon.net/Allomon,https://wikimon.net/File:Allomon.jpg,Allomon.jpg,"an armor-level dinosaur digimon that evolved through the power of the ""digimental of courage"". particularly ferocious among dinosaur digimon, it is in a hostile relationship with fellow dinosaur-type tyranomon. allomon's special features are having powerful leg strength, and being able to run at blistering speed by tilting its head down and taking a horizontal stance. its special move is spewing out an ultra-high temperature wind (dino burst).  digimon life virtual pets  video games"
Allomon_(X-Antibody),https://wikimon.net/Allomon_(X-Antibody),https://wikimon.net/File:Allomonx2.jpg,Allomonx2.jpg,"an armor-level dinosaur digimon that evolved through the power of the ""digimental of courage"". particularly ferocious among dinosaur digimon, it is in a hostile relationship with fellow dinosaur-type tyranomon. allomon's special features are having powerful leg strength, and being able to run at blistering speed by tilting its head down and taking a horizontal stance. its special move is spewing out an ultra-high temperature wind (dino burst).the effect on allomon's digicore due to the x-antibodyits leg strength has developed further, and it acquired agility on par with that of small digimon despite being a large digimon. its running speed has also increased, but this large allomon soars, and it is said that many digimon have seen it swoop down and seize the enemy. as a result of adapting to its agile body, it acquired a new special move called ""dino flash"", an ultra-high temperature wind released from its mouth instantaneously like a flash.  virtual pets misc"
Alphamon,https://wikimon.net/Alphamon,https://wikimon.net/File:Alphamon.jpg,Alphamon.jpg,"one of the holy knight-type ""royal knights"", the highest rank of network security which is said to have thirteen members. while it is a holy knight, it is said that to the holy knights it is a being similar to a deterrent force, and as it doesn't appear in normal times, it is also called the ""aloof hermit"" who flutters a blue mantle, and is the ""royal knight"" assigned to the place called the ""empty seat"". because it possesses the ""alpha inforce"" ability, an ultimate force which, in battle, instantaneously replays the elapsed battle, although alphamon's attacks are over in just an instant, you can't grasp how many attacks it actually unleashed, and in theory, you can only see the final blow that brought down its opponent. it can deploy a magic circle of digimoji from its hands, which attacks and defends. its special moves are drawing out a convergence of light that was pierced into the center of a magic array and stabbing it through the opponent (seiken gradalpha), and spreading the wings on its back and flying up high, then deploying a magic circle even larger than the sky, with which it summons a legendary monster from another dimension (digitalize of soul).  digimon life virtual pets"
