name,full_page_wiki_url,image_url,image_filename,description
Pyonmon,https://wikimon.net/Pyonmon,https://wikimon.net/File:Pyonmon.jpg,Pyonmon.jpg,"a baby digimon covered in tufty body hair that has a single large ear. it was shy the moment it was born, so if someone stares at it, it will instantly lower its head. however, it is also friendly, and can be seen rubbing its body against digimon that it is interested in, actively engaging in skin-to-skin contact. it hates opponents that mess with it, and has the power to blow even child digimon away with its ""earnta"", in which it slaps them with its large ear. similarly, it hates things which make loud noises that ring in its ear, so it lowers its ear and leaves."
Qinglongmon,https://wikimon.net/Qinglongmon,https://wikimon.net/File:Qinglongmon.jpg,Qinglongmon.jpg,"one of the four holy beasts who protect the digital world, it guards the east and releases intense lightning strikes. it is a legendary being like the other four holy beast digimon, and its strength is said to equal that of a god. also, it is counted as one of the four great dragons alongside holydramon, goddramon, and megidramon, and is the most deified existence among them. however, although it is a divine being, it will not easily cooperate with humans and the weak, and it is not likely to lend help to its allies unless there is something serious. its special move is loosing intense thunderbolts from the sky, with divine fury (sourai).  digimon life virtual petscurrent original"
Quantumon,https://wikimon.net/Quantumon,https://wikimon.net/File:Quantumon.jpg,Quantumon.jpg,"an ultimate digimon enshrined in the aerial city of ""larc"", which floats above the vast ""net ocean"", shrouded by enormous clouds. quantumon extracts huge amounts of data from the net ocean using the expansion devices installed on larc, and conducts millions upon trillions of simulations of the future. together with its digimon followers, quantumon implements the best measures it has formulated against disasters that are predicted to occur in the digital world.its special move is transforming space into a gate via quantum processing, and forcefully sending the enemy into another dimension (unlimited journey). this technique can also be used to forcibly avoid other digimon, or send them to another dimension for their own research and analysis. in addition, it can also manipulate the flow of time, causing quantum decay at specific coordinates with its ""hazy time""."
Quartzmon,https://wikimon.net/Quartzmon,https://wikimon.net/File:Quartzmon.jpg,Quartzmon.jpg,"a colossal digimon that continues to absorb data and amplify its power. the great evil globe, which corresponds to most of its body, has become a fusion reactor that generates ""gypt particles"", quartzmon's power source, from the data it has absorbed. quartzmon's true form is at the very top, and can act independently of the great evil globe, and furthermore, it is also capable of altering its appearance. it wants the data of the entire world, and digimon are completely engulfed and absorbed by it as well. its special move is emitting the gypt particles generated within the great evil globe into its entire surroundings (gypt ryushi hou), and if you touch them even the slightest bit, they will spread throughout your whole body and completely erase you without leaving any data behind. also, with its ""ruin blast"", which injects gypt particles into the body of an enemy it seizes with its tentacles, the enemy causes an internal explosion.   video games"
Queen_Chessmon,https://wikimon.net/Queen_Chessmon,https://wikimon.net/File:Queenchessmon.jpg,Queenchessmon.jpg,"the strongest digimon of the chessmon series which possesses extreme range and offensive ability. it is a reliable being that defends the cowardly king chessmon. that superior offensive ability is a power that sometimes seems rather inhuman. its catchphrase is, ""god of chess, bestow pardon!"" its special moves are impaling the opponent's vitals with the swords on its armor (heart breaker), ""queen stamp"", and ""queen stick"". also, it can give the opponent a hard time with its ""hime no wagamama"".  digimon life virtual pets"
Rafflesimon,https://wikimon.net/Rafflesimon,https://wikimon.net/File:Rafflesimon.jpg,Rafflesimon.jpg,"an ultimate-level fairy digimon said to be the largest flower in the digital world. while its appearance is so beautiful that it enraptures all who lay eyes upon it, the stench it emits is out of this world. there are a number of people who fell for rafflesimon's beauty at first sight and sought to find it again after a single glance. however, rafflesimon's lifespan is short, and its life processes will cease after just several days have passed. because of the extremely low likelihood of being able to catch sight of a rafflesimon, it is also known as the ""miraculous flower"". despite its circumstances, rafflesimon never expresses any pessimism about its looming death, constantly yearning to live a normal life and dancing elegantly till its very last.its special move is firing its sleeve like a cannon (ballet gun). it utilizes the large flower petals that dance around it as reflectors, reflecting its shots so that no enemy can escape. not only that, it can also shed scales from its body (wisselen). these scales cause anyone whose body they have latched onto to lose consciousness and turn into rafflesimon's servants.   misc"
Ragna_Lordmon,https://wikimon.net/Ragna_Lordmon,https://wikimon.net/File:Ragnaloardmon.jpg,Ragnaloardmon.jpg,"a digimon born from the jogress between durandamon, the strongest sword among the legend-arms, and bryweludramon, who is said to be the strongest shield. it is said to have been born when an evil being lurking in the depths of the dark area awakened, and the digicores of the two legend-arms resonated with each other. its main body, formed from the fusion of the digicores at a higher plane, was made in the image of ""the knight that would wield them"" as imagined by durandamon and bryweludramon.while ragna lordmon is a jogress form, it is unusual in that it still retains durandamon and bryweludramon's consciousnesses, while the main body itself has its own, separate consciousness. the sword and shield hover and move out of their own wills without coming into direct contact with ragna lordmon; they make sport of the enemy with the way they enact their offensive and defensive maneuvers like three separate beings in one body. their level of coordination is stunning, giving rise to its absolute defense and sudden and unpredictable, yet powerful attacks, which are nigh impossible to overcome.its special moves are bisecting the enemy in a single stroke by cleaving its sword down from a high altitude (direct smasher), and spewing extremely high temperature flames from its shield, turning its surroundings into a sea of fire (ignition prominence). not only that, its greatest technique ""duel edge-flowsion"", in which it impales the enemy with its sword wreathed in its shield's flames, completely incinerates the enemy's data right down to their digicore and erases them without a trace."
Ragnamon,https://wikimon.net/Ragnamon,https://wikimon.net/File:Ragnamon.jpg,Ragnamon.jpg,"an ultimate that boasts the largest size among digimon. having taken in the data of an artificial satellite, it possesses a variety of satellite weapons that are enough to annihilate vast areas of the digital world from high above. however, it requires a large amount of resources to operate, necessitating the support of proficient hackers, so there are few records of it appearing on the battlefield.its special moves are ""gimlet gun"", in which it pierces with its tail, ""spaser"", in which it fires an enormous laser from its head, ""shuttle scissors"", in which it seizes the enemy with its right arm and severs them, ""satellite buster"", in which it picks off distant enemies with the gun barrels on its shoulders, and ""ragnarok cannon"", which is fired from its chest, providing maximum offensive power. in addition, whenever it receives an attack from the enemy, it analyzes it, and is capable of unleashing that attack's power back at them. current original"
Raguelmon,https://wikimon.net/Raguelmon,https://wikimon.net/File:Raguelmon2.jpg,Raguelmon2.jpg,"an ultimate level digimon who observes all angel digimon with eyes of distrust, in order to prevent the fall of other angel digimon. the moment it detects an angel digimon that has begun to fall, it will attack and destroy them before they would have fallen completely. however, because it was shunned for its role as an observer, it began to be filled with nihilistic thoughts until its sole line of thought was to reject everything. at that stage, it no longer discerns between friend and foe, turning into a fearsome digimon that carries out destruction indiscriminately.its special move is mutilating the enemy using the claws on its arms and the tip of its tail (form taranis). once it impales the enemy, it injects destructive data that eat away at and corrode the enemy from the inside. it can also fire laser bullets from the gemstones situated on its arms and chest (purhorus)."
Raidenmon,https://wikimon.net/Raidenmon,https://wikimon.net/File:Raidenmon.jpg,Raidenmon.jpg,"a heavyweight-class machine type digimon equipped with electromagnetic weapons. it was created as a shooting-type, unlike raijinmon, who similarly uses lightning as its energy. although it is not as adept in close combat, it defends itself using its thick armor, and counterattacks with its left arm. its special moves are causing a corona discharge brought upon by a 45000-volt electric attack (kirlian brand), and firing ultra-high temperature spheres from the gun barrels on both of its shoulders (rising sun)."
Raihimon,https://wikimon.net/Raihimon,https://wikimon.net/File:Raihimon.jpg,Raihimon.jpg,"a digimon that possesses power over darkness that has transcended legend by inheriting all the might of one of the legendary ten warriors and acquiring unknown abilities. there are none who have seen this hero, and due to the fact that it doesn't leave behind so much as evidence of the opponents it has confronted, it is called the ""guardian emperor of darkness"". its special moves are disabling all of the laws of physics in the surrounding region and bringing down the opponent (schwarz lehrsatz), and an attack fired from the eyes of the lion on its head (rot kreuz).  digimon life misc"
Raiji_Ludomon,https://wikimon.net/Raiji_Ludomon,https://wikimon.net/File:Raijiludomon.jpg,Raijiludomon.jpg,"the evolved form of tia ludomon, it has been further mechanised and attained the ability to fly. by sacrificing its agility, it gained durability that allows it to withstand even an attack from an ultimate level head-on. the shields attached to its shoulders and arms automatically put up an electric barrier which cannot be seen, causing enemies to be confused as to why their attacks are not working. not only that, it is also able to increase the area covered by its barrier in exchange for being unable to move, allowing it to protect entire regions to a certain extent.its special moves are generating electricity at high output from its head and using it to strike the enemy (lightning buster), and firing its (rocket messer) from both arms.  misc"
Raijinmon,https://wikimon.net/Raijinmon,https://wikimon.net/File:Raijinmon.jpg,Raijinmon.jpg,"a cyborg digimon bestowed with the name of the raijin of oriental folklore. a fighting-type that is strong in close combat, its signature move is ""blitz arm"", in which it dishes out a barrage of punches with the same lightning-type arm as justimon. its special move is charging with the connector on its tail, and firing intense lightning from its shoulders into its surroundings (elekugel)."
Ranamon,https://wikimon.net/Ranamon,https://wikimon.net/File:Ranamon2.jpg,Ranamon2.jpg,"a digimon that possesses power over water which bears the might of one of the legendary warrior ten. it has a sharp intuition and an unstable mood, possibly because it had been in an area that was mostly active in a section of the ocean within a weather forecasting system. its emotions are erratic; when it is in good mood, it shows off how graceful and lady-like it is, but when it gets upset, it cries hysterically like a baby. in battle, it rarely attacks directly, and mainly does so indirectly by manipulating rain. however, since its combat abilities are intense when it is emotionally overwrought, its attacks are especially uncontrollable while it is crying. its special moves are concentrating heavy rain over an enemy and crushing them (rain stream), and dissolving all enemies with acid rain (jealousy rain).  digimon life misc"
Rapidmon_(X-Antibody),https://wikimon.net/Rapidmon_(X-Antibody),https://wikimon.net/File:Rapidmonx.jpg,Rapidmonx.jpg,"a holy knight digimon that armor evolved from terriermon with the ""digimental of fate"". rapidmon is normally a perfect which evolves from galgomon, but thanks to the ""digimental of fate"", it is able to shine gold and sublimate power up to the ultimate level. its special moves are rapid-firing homing missiles from both of its arms and the revolver equipped to its back (rapid fire), and ""golden triangle"", which is similar in power level to magnamon's special move, ""extreme jihad"".the effect on rapidmon's digicore due to the x-antibodythe power contained within the digimental of fate has been drawn out even further by the x-antibody, and it is now capable of constantly exhibiting power at the ultimate level. the armaments on both of its arms and back form the ""armed arms""; it rapid-fires its ""rapid blaster"", which has a low attenuation rate, at long-range, and its ""laser gatling arm"", where it switches from the armed arms on its back, at close-to-mid-range. in addition, a booster function has also been added, allowing it to dive into the enemy's chest at high speed, and slash them with its claws.its greatest special move is detaching all of the armed arms, cornering the enemy by operating them remotely, and shooting them up with a billion bullets (billion bullet).  misc"
Rapidmon_Armor,https://wikimon.net/Rapidmon_Armor,https://wikimon.net/File:Rapidmon%28armor%29.jpg,Rapidmon%28armor%29.jpg,"a holy knight digimon that armor evolved from terriermon with the ""digimental of fate"". rapidmon is normally a perfect which evolves from galgomon, but thanks to the ""digimental of fate"", it is able to shine gold and sublimate power up to the ultimate level. its special moves are rapid-firing homing missiles from both of its arms and the revolver equipped to its back (rapid fire), and ""golden triangle"", which is similar in power level to magnamon's special move, ""extreme jihad"".  digimon life"
Rapidmon_Perfect,https://wikimon.net/Rapidmon_Perfect,https://wikimon.net/File:Rapidmon.jpg,Rapidmon.jpg,"a cyborg digimon, evolved from galgomon. it holds the alias of ""keen hound"", and it reliably brings down the opponent with movements near the speed of light. also, it freely uses its gigantic ears as radar, can act even in the dark, and is also able to detect the existence of distant enemies. the silhouette of its body makes you think of a shaved poodle. during battle its neck protector shuts. its special moves are rapid-firing homing missiles from both of its arms and the revolver equipped to its back (rapid fire), and firing a beam from its whole body that completely disassembles the opponent's data (golden triangle).  digimon life  misc"
Raptordramon,https://wikimon.net/Raptordramon,https://wikimon.net/File:Raptordramon.jpg,Raptordramon.jpg,"a cyborg digimon that transformed itself from a wild digimon that possessed a predatory instinct into a basis for modifications, in order to reliably bring down its targets. because the ferocious nature it possesses is too strong for its organic body to bear, it remodeled them with their corresponding weight in chrome digizoid, restraining their capacity for movement. however, whether it has high power output and flying ability or not is due largely to the organic body of the wild digimon, before it was modified. although it's small, if it gradually releases those abilities, it has the capability to easily bring down even a massive digimon in a single blow. its signature move is an assault that capitalizes on the sharpness of its chrome digizoid armor (crash charge). its special move is leaping upon the opponent and instantly biting and rending their vitals with its sharp teeth (ambush crunch).  virtual petscurrent original"
Raptor_Sparrowmon,https://wikimon.net/Raptor_Sparrowmon,https://wikimon.net/File:Raptor_sparrowmon.jpg,Raptor_sparrowmon.jpg,"an evolution of sparrowmon whose entire body has become clad in armor made from chrome digizoid. its chrome digizoid armor eliminated its weakness, the inability to take hits, and its flexible wings have given it the ability to make sharp turns at high speed. while it excels in tactics such as hit-and-run and disrupting the battlefield, its temperamental personality still remains and it often makes blunders.its special move is ""raptor grapple"", an improved version of ""crash boom"" where it ensnares the opponent and slams them down from high up in the sky. it also has a technique, ""crash charge"", where it charges forth and capitalizes on its chrome digizoid armor.  current original"
Raremon,https://wikimon.net/Raremon,https://wikimon.net/File:Raremon.jpg,Raremon.jpg,"an undead digimon whose muscles have all rotted away. it tried to extend its life by mechanizing its body, but it destabilized its body, and its configuration data has begun to break down. however, because it was given life by those machines, it will not die, and survives with this grotesque appearance. because its body has broken down, its offensive power and mental capacity are nonexistent, and it acts on instinct. it gives off a foul stench from its entire body, so that digimon up to the child-level will simply run away, and will not be its opponent until they grow to the adult-level.  virtual pets  video games"
Rare_Raremon,https://wikimon.net/Rare_Raremon,https://wikimon.net/File:Rareraremon.jpg,Rareraremon.jpg,"the perfect of raremon that survived the advanced decay of its body through further mechanization and took on a bizarre appearance. its body repeatedly breaks down and reconstitutes itself, and eyes and mouths keep emerging and decaying. the foul stench it gives off from its entire body has increased so much that even ultimates have difficulty approaching it. because it consumes energy to keep its body intact, it supplies itself with energy by dissolving enemies with its ""digest"", in which it swallows them whole via the mouth on its head. in addition, it spews a toxic gas out of its many mouths (decayson), and enemies that inhale it die instantly."
Rasenmon,https://wikimon.net/Rasenmon,https://wikimon.net/File:Rasenmon.jpg,Rasenmon.jpg,"rasenmon's true form, which it attained after accepting its negative emotions without fearing them and regaining the courage it needed to believe in itself. having broken free of the negative emotions that shackled it down, it is now reborn into this new form and is able to completely control the power that drove it berserk in the past; its violent temperament has also faded, and it now sports a kind and gentle personality.in battle, it is capable of amassing even more power by absorbing the energy derived from its allies' emotions; however, it is only able to use this ability to carry out actions it believes are right.its special moves are dishing out a powerful punch while spinning the blades on its arm (gyro smash), as well as spinning its blades at extremely high speed, creating tornadoes that strike the opponent (qualialise blast). not only that, rasenmon's ""spiral vanish"" move, in which it shoots out and fuses all of the spiral-shaped spines covering its body to form a gigantic drill which it uses to impale the opponent, is its trump card where it unleashes all of the emotion energy it has stored together with its drill to deliver a crushingly powerful blow."
Rasielmon,https://wikimon.net/Rasielmon,https://wikimon.net/File:Rasielmon.jpg,Rasielmon.jpg,"an ophan digimon that was once appointed to the same rank as ofanimon. it possesses the mysterious power to foresee everything in the world from the ""kernel"" (god's domain). it is said that it knows all about events throughout the digital world, and has gained a divine amount of knowledge with that power.its special moves are freely combining the five elements from the magic circles on its arms and releasing enormous energy (knowledge stream). and, as for its ""sefer raziel"", which brings about all kinds of miracles to exterminate the adversary, not even rasielmon itself knows what will happen.  virtual pets"
Ravmon,https://wikimon.net/Ravmon,https://wikimon.net/File:Ravmon.jpg,Ravmon.jpg,"a cyborg digimon which possesses a wing made of chrome digizoid. at the genesis of the digital world, it was a digimon that served under a certain god man digimon and was titled the ""silver crow"", but it is said that it was touched by that god's anger and one of its wings was dyed black. the true terror of ravmon is in its covert actions. it conceals its figure with its black wing, and slashes the opponent with its white wing. suddenly appearing out of nowhere, it brings down the opponent in a single blow. its special moves are raising the sharp nails on its left arm and then performing a rotating rush at the opponent (spiral raven claw), and cutting the opponent to pieces with its left wing (blast wing). also, it strikes the opponent with the sword ""chouou-maru"" which it unleashes with nimble movements, and the blade of dark lightning which is released from the ""chouou-maru"", ""ame-no-ohabari"", possesses tremendous destructive power.  digimon life current original"
Rebellimon,https://wikimon.net/Rebellimon,https://wikimon.net/File:Rebellimon.jpg,Rebellimon.jpg,"a cyborg digimon equipped with a high-powered engine. it is said to have evolved from a digimon driven to the brink of death that took in junk data from its surroundings. it is an outlaw who loots parts from other machine-species digimon in order to further strengthen and remodel its body, which is made out of junk. occasionally, it has been witnessed racing noisily with large gangs of machmon.its special moves are firing a large quantity of missiles from its left arm (vanquish missile), and pulverizing the enemy's body as it minces them with the heavy machinery on its right arm (maximum demolisher).   misc"
Red_V-dramon,https://wikimon.net/Red_V-dramon,https://wikimon.net/File:Red_Vdramon_recolor.jpg,Red_Vdramon_recolor.jpg,"a mythical dragon digimon! it is said that when v-dramon is consumed by anger, it undergoes a glowing-red evolution, but...v-breath arrowa technique in which it spews a v-shaped high-temperature heat ray from its mouth. it is extraordinarily potent, and entirely effective against even powerful digimon!digimon adventure 02: d1 tamers video gamesd1 tamers next 0rder"
Red_Vegimon,https://wikimon.net/Red_Vegimon,https://wikimon.net/File:Redvagimon.jpg,Redvagimon.jpg,"a strengthened version of vegimon whose entire body has ripened and turned red. it has high intelligence and offensive ability, unlike vegimon, who is still unripe. this red, ripened form is vegimon's true form, and it is possible that the harsher environments found on the folder continent caused vegimon to take on this original form. its personality has turned even more devious and cunning. its special move is a spewing out its putrid, poison-laced breath (hazard breath). anyone who carelessly tries to take it on, mistaking it for an ordinary vegimon, will no doubt meet a terrible fate.  digimon life virtual pets"
Regalecusmon,https://wikimon.net/Regalecusmon,https://wikimon.net/File:Regalecusmon.jpg,Regalecusmon.jpg,"an aloof aquatic digimon that hates crowds. it is a pirate who repeatedly assaults and plunders the feeding grounds and territories of other digimon, and also the ruler of the abyss that stands at the apex of the food chain due to its overwhelming power. its sword, which it made after tearing off a zudomon's horn, and the giant pincer on its left arm are symbols of awe that strike fear into those who lay their eyes upon them.its special moves are piercing the enemy with the sword in its right hand, accompanied by a flash of lightning (briona strike), and blowing away everything around it, including seawater, with plasma discharged from its pincer (reactor discharge).  misccurrent original"
Regulusmon,https://wikimon.net/Regulusmon,https://wikimon.net/File:Regulusmon.jpg,Regulusmon.jpg,"an evil dragon digimon that plots to rule through rage and fear. despite being a perfect, it boasts a power that is reminiscent of megidramon, one of the four great dragons digimon who is renowned for being the most evil, and so regulusmon's arrival is nothing short of a disaster. its body is the source of an infection known as ""grb"" (gulus realm burst)[n 1], and it is said that digimon infected with ""grb factor"" have their personalities altered and become frenzied. however, the infection has not been confirmed in digimon that have had the secretion ""black digitron"", which is said to be the primary cause of digimon turning black, mixed in with them.its special moves are opening the shield on its left arm wide and biting the enemy with it (kalyp bite), firing three penetrating lasers from its shield (genierce), and piercing the enemy with its two-pronged tail (dead-end spike). in addition, for its greatest threat ""gran tres"", it shoots a dark hellfire sphere from its mouth, swallowing not only matter but also light, and erasing everything without leaving a trace.  video games"
