name,full_page_wiki_url,image_url,image_filename,description
Dukemon,https://wikimon.net/Dukemon,https://wikimon.net/File:Dukemon.jpg,Dukemon.jpg,"this holy knight digimon is called one of the ""royal knights"" alongside omegamon and magnamon. the royal knights are digimon assigned the highest rank of network security, so it is absolutely impossible to violate security in their presence. it is a living contradiction, being a guardian deity of the net despite being a virus attribute, and if by any chance its balance is lost, it is possible for it to become a dangerous being. it is clad in holy armor refined and constructed from 99.9% pure chrome digizoid, and it wields the holy lance ""gram"" in its right hand and the holy shield ""aegis"" in its left. it honors chivalry, and is a loyal vassal towards its lord. its special moves are a strong blow dispatched from the holy lance gram (royal saber), and firing a beam which purifies everything from the holy shield aegis in its left hand (final elysion).  digimon life"
Dukemon_(X-Antibody),https://wikimon.net/Dukemon_(X-Antibody),https://wikimon.net/File:Dukemonx.jpg,Dukemonx.jpg,"this holy knight digimon is called one of the ""royal knights"" alongside omegamon and magnamon. the royal knights are digimon assigned the highest rank of network security, so it is absolutely impossible to violate security in their presence. it is a being containing contradictions, as it is called a guardian deity of the net despite being a virus attribute, and if by any chance its balance is lost, it is possible for it to become a dangerous being. it is clad in holy armor refined and constructed from 99.9% pure chrome digizoid, and its right hand can become the holy lance ""gram"" while its left hand can become the holy shield ""aegis"". it honors chivalry, and is a loyal vassal towards its lord. its special moves are a strong blow dispatched from the holy lance gram (royal saber), and firing a beam which purifies everything from the holy shield aegis in its left hand (final elysion).the effect on dukemon's digicore due to the x-antibodycarrying out its devotion as a knight, this dukemon threw itself into the sacred battle and was at last blessed with the supreme sacred armor, sacred lance, and sacred shield. it has sacred hybrid equipment combining ""red digizoid"", ""blue digizoid"", and ""gold digizoid"", which are rare metals, as well as chrome digizoid boasting the highest known purity. since its form was remodeled in order to demonstrate its holy power, the lance of light emitted from its sacred lance gram was amplified, and it acquired a new special move called ""sieg saber"" which lengthens it. in addition, it is said that dukemon's red mantle from before acquiring the x-antibody was given to the hero, leomon.  digimon life virtual pets"
Duramon,https://wikimon.net/Duramon,https://wikimon.net/File:Duramon.jpg,Duramon.jpg,"as it continues to sprint forward, this perfect level digimon is a step closer to crossing into the world on the other side. although it knows not what future awaits it, it continues training and tempering its swords to cut through any obstacles that stand in its way. when it transforms itself into a weapon, it uses the characteristic greatsword on its back to unleash countless varieties of attacks. its special moves are slicing the enemy with the blades on both arms (grasslash), and firing a beam attack from its chest, which deals massive damage and carves a '20' mark into the enemy if it lands a direct hit (blindead).  virtual pets misc"
Durandamon,https://wikimon.net/Durandamon,https://wikimon.net/File:Durandamon.jpg,Durandamon.jpg,"a digimon possessing the ultimate holy blade, it evolved by honing its sword to its best ability and attaining data on 'legendary swords' found in mythology and video games. boasting strength that puts it among the strongest legend-arms capable of transforming into swords, it is said that wielding durandamon in sword form will surely bring about victory. its slashing attacks are fierce enough to cut through any sort of defense, although there have been records that only the strongest of the legend-arms digimon capable of transforming into shields are able to withstand durandamon's attacks.its special moves are focusing its fighting spirit into the blades on both arms and slicing the enemy with them (zwanglanze), and spinning its body to slice multiple enemies in one fell swoop (thron messer). while both attacks are powerful enough to take enemies down in one hit, durandamon's greatest appeal is still its ability to transform into a weapon and unleash slashing attacks.  virtual pets"
Duskmon,https://wikimon.net/Duskmon,https://wikimon.net/File:Duskmon.jpg,Duskmon.jpg,"a digimon that possesses power over darkness which bears the might of one of the legendary ten warriors. the regret of various extinct species of digimon and the ""forbidden data"" on the net transformed into intense dark energy, and coalesced into duskmon. the dark energy exists in order to oppose the light of holy beings, and the one who possesses power over light is the flip side of the same coin. it has a thoroughly evil personality, so it is both callous and cruel. it is the possessor of demon lord-like dignity that is overflowing with perfectionism and confidence. it is invincible in battle when wielding its swords, and does not hesitate with its inhuman attacks. its special moves are making the eyes all over its body shine and placing the opponent under hypnosis (geist abend), and absorbing the opponent's power with its two demonic ""blut evolution"" swords and making it its own (eroberung). by the way, due to the ability of the three heads and seven eyes on its armor to act on their own as if they were separate creatures, true evil is sealed in them.  digimon life"
Dynasmon,https://wikimon.net/Dynasmon,https://wikimon.net/File:Dynasmon.jpg,Dynasmon.jpg,"one of the holy ""royal knights"", it possesses the powers of the wyvern. it is a unique being among the royal knights, in that it serves the lord who embodied its own sense of justice with deep, unquestioning loyalty. for example, for the sake of its own justice, it won't hate its lord even if they are called ""evil"". for that reason, it has a strong spirit of chivalry and bushido, with a character that honors devotion, fidelity, and courtesy. with its tenacious, dragon-like power, and dragon armor made from high-purity chrome digizoid, it boasts unparalleled strength. its special moves are firing energy shots from the palms of its hands, with all the attributes of the ten warriors (dragon's roar), and transforming its body's energy into an aura of a gigantic wyvern (breath of wyvern).  digimon life"
Dynasmon_(X-Antibody),https://wikimon.net/Dynasmon_(X-Antibody),https://wikimon.net/File:Dynasmonx.jpg,Dynasmonx.jpg,"one of the holy ""royal knights"", it possesses the powers of the wyvern. it is a unique being among the royal knights, in that it serves the lord who embodied its own sense of justice with deep, unquestioning loyalty. for example, for the sake of its own justice, it won't hate its lord even if they are called ""evil"". for that reason, it has a strong spirit of chivalry and bushido, with a character that honors devotion, fidelity, and courtesy. with its tenacious, dragon-like power, and dragon armor made from high-purity chrome digizoid, it boasts unparalleled strength. its special moves are firing energy shots from the palms of its hands, with all the attributes of the ten warriors (dragon's roar), and transforming its body's energy into an aura of a gigantic wyvern (breath of wyvern).the effect on dynasmon's digicore due to the x-antibodyalthough the abilities of the wyvern have been drawn out dramatically, transforming it into a baleful figure, its dragon armor is mostly composed of the lightest ""blue digizoid"". nevertheless, it is because of the excess, tenacious power of the wyvern that allows the large, heavyweight dynasmon to reach high altitudes in an instant with a sweep of its wings. as long as it is for the sake of its lord, it will unleash its ""dragon's gust"", in which it thrusts the gigantic horns on its head, soars, and then charges into the enemy with its body, leading it to being the most skillful among the royal knights when it comes to aerial combat.  digimon life virtual pets misccurrent original"
EBEmon,https://wikimon.net/EBEmon,https://wikimon.net/File:Ebemon.jpg,Ebemon.jpg,"a cyborg digimon that was artificially created from a vademon that was captured, and had its configuration data analyzed and improved. in a certain country's facility, called ""area 51"", it seems they were using and building extraterrestrial technology, but the truth is shrouded in mystery. its special move ""brain rupture"" is firing a cracking program into the opponent's brain with the gun it holds in its left hand, then absorbing all the data stored in their brain. its ""planet destroyer"" is a technique that releases all of its accumulated power and fires it off from the gun in its right hand, so it is said that it's able to instantly destroy a single planet. it is said that that certain country is covertly conducting research and development on digimon in order to take possession of the digital world.ebemon was adopted from a winning digimon illustration entry in the ""digimon web dot-art contest"" which belonged to mr. yousuke from gifu prefecture."
EBEmon_(X-Antibody),https://wikimon.net/EBEmon_(X-Antibody),https://wikimon.net/File:Ebemonx.jpg,Ebemonx.jpg,"a cyborg digimon that was artificially created from a vademon that was captured, and had its configuration data analyzed and improved. in a certain country's facility, called ""area 51"", it seems they were using and building extraterrestrial technology, but the truth is shrouded in mystery. its special move ""brain rupture"" is firing a cracking program into the opponent's brain with the gun it holds in its left hand, then absorbing all the data stored in their brain. its ""planet destroyer"" is a technique that releases all of its accumulated power and fires it off from the gun in its right hand, so it is said that it's able to instantly destroy a single planet. it is said that that certain country is covertly conducting research and development on digimon in order to take possession of the digital world.ebemon was adopted from a winning digimon illustration entry in the ""digimon web dot-art contest"" which belonged to mr. yousuke from gifu prefecture.the effect on ebemon's digicore due to the x-antibodyebemon's ability to continuously make further improvements to itself was demonstrated at a certain country's ""area 51"". the gun in its right hand is so high performing that it can even be regarded as its second brain; it instantly makes calculations for any location or target and fires its ""planet destroyer justice"", which is always shot with 100% accuracy albeit somewhat forced. even a shot that is considered to be a misfire is a way of showing and justifying that the outcome was within its calculations."
Ebi_Burgamon,https://wikimon.net/Ebi_Burgamon,https://wikimon.net/File:Ebiburgamon.jpg,Ebiburgamon.jpg,"a digimon that took in food data. maybe because it consists of the selected ingredient data, it is a digimon with a pure heart. ebi burgamon is a variant species of burgamon, and has taken in the ingredient data of fresh shrimp. its special moves are its ""fresh shrimp"" and ""hot cutlet"", which produce smells savory enough to stop the opponent in their tracks.  digimon life misc"
Ebidramon,https://wikimon.net/Ebidramon,https://wikimon.net/File:Ebidramon.jpg,Ebidramon.jpg,"a nonconformist of the dramon-type which has a tough, shrimp-like shell and gigantic pincers. if one is misled by its outward appearance and makes light of ebidramon, they will become prey of the offensive ability characteristic of the dramon-type. its special move is swooping down on them with its two pincers (twin neptune).  virtual pets  video games"
Ekakimon,https://wikimon.net/Ekakimon,https://wikimon.net/File:Ekakimon.jpg,Ekakimon.jpg,"the digimon with the greatest passion for art amongst everyone in the digital world. its body is made up of vibrant colored pencils, and it is always drawing pictures that it likes no matter the time and place. the pencils can also be used for its attack ""colorful change"", which changes depending on the colors used. the attack ""colorful change"" turns fire-elemental when red is used, water-elemental when blue is used, grass-elemental when green is used, and so on and so forth. not only that, it is able to draw tiny ekakimon and cause them to materialize into ""mini mini ekakimon"", which it will order around like henchmen to fight the opponent.a winning entry in the digimon xros wars original digimon contest.   video games"
El_Doradimon,https://wikimon.net/El_Doradimon,https://wikimon.net/File:Eldoradimon.jpg,Eldoradimon.jpg,"a mutation digimon that once wandered into the research data for ancient ruins on a neglected computer, and over a long period time unified with that data. once its head, arms, and legs are retracted, it looks indistinguishable from the ruins of an ancient fortress. the enormous quantity of research data it holds has turned it into a slow-witted digimon with a large build; nevertheless, bringing it down is likely a difficult task, even if it is attacked by scores of digimon. it is the very definition of an impregnable digimon. its special moves are charging the opponent with its large body and breaking through, even while under attack (golden road), and striking with its gigantic foot, shaking the earth (meteor earthquake). also, it can bite through the opponent with the power of its mighty jaws (giant nipper).  digimon life  misc"
Elecmon,https://wikimon.net/Elecmon,https://wikimon.net/File:Elecmon.jpg,Elecmon.jpg,"a mammal digimon that retained tunomon's mammal-like elements and evolved. it's very curious and lively, and inherited its prank-loving personality from tunomon. also, elecmon possesses nine tails, and during battle, it fans out its tail like the plumage of a peacock to intimidate its opponent. its special move is ""sparkling thunder"".  digimon life virtual pets"
Elecmon_(Violet),https://wikimon.net/Elecmon_(Violet),https://wikimon.net/File:Elecmon_violet.jpg,Elecmon_violet.jpg,"an elecmon that evolved into a virus-type. it has an unpleasant personality that bullies indiscriminately, and dextrously uses its tails to strike the enemy. its signature move is unleashing a nine-hit combo with its nine tails (tail dusk). its special move is generating electricity with the static produced by rubbing its tails together, causing interference through jamming waves (jamming thunder).  misc"
Elephamon,https://wikimon.net/Elephamon,https://wikimon.net/File:Elephamon.jpg,Elephamon.jpg,"an armor-level cyborg digimon that evolved through the power of the ""digimental of miracles"". it is a super digimon that overwhelms other digimon with its large build and extreme power, capable of moving at high speeds contrary to its appearance thanks to its gigantic ear turbines. although it is unable to fly in the air using its turbines, their hovering function allows it to move by slightly floating above the ground, so it can even travel on water. while it has a very gentle personality, it is a digimon with a strong sense of justice, so it can be said that elephamon is terrifying being as far as evil digimon are concerned. its special move is vertically raising its ear turbines, and spinning them at maximum output to generate a shock wave on the same level as a huge typhoon (nitro turbine wave).  digimon life virtual pets misc"
Entmon,https://wikimon.net/Entmon,https://wikimon.net/File:Entmon.jpg,Entmon.jpg,"a plant digimon with a body woven and fused together from dead trees. its whole body has rotted away in places, and mold grows on parts where the bark has been exposed. its body is packed with a large number of insects, serving as the muscles that move its body around. it is very terrifying to see the insects spill out of the joints all over its body each time it takes off with its dead leaf wings.its special moves are skewering the enemy with its sharp stake-like tusks (dryad stinger), and spewing a black miasma which causes the opponent's body to completely wither up (blasted disaster). the true form of the miasma is countless tiny insects that thrive on a digimon's data.   misc"
Eosmon_(Adult),https://wikimon.net/Eosmon_(Adult),https://wikimon.net/File:Eosmon_adult.jpg,Eosmon_adult.jpg,"an artificial digimon that was created based on a certain digimon. the prevailing view that the child level is the final form of artificial digimon has been refuted due to the passion of researchers with the changing times, allowing them to evolve to the adult level. because eosmon lacks emotion and moves according to the researcher's instructions, its good or wicked actions are down to the researcher.its transparent, panel-shaped wings are used in its ""mirror guard"", where it spreads them to protect itself or the target, and in its ""mirror dust"", where it detaches them and sends them flying at the enemy. furthermore, it has the special move ""bolt rip"", in which it mixes its scales with electric shocks gathered in its palms and fires them at the enemy.  misc"
Eosmon_(Perfect),https://wikimon.net/Eosmon_(Perfect),https://wikimon.net/File:Eosmon_perfect.jpg,Eosmon_perfect.jpg,"the form adult-level eosmon evolved into when a problem occurred as it was carrying out a mission. it deploys even more transparent panels, and has acquired high-speed movement with its enormous wings and high offensive power with its gigantic hands. in addition, it can also create illusions by using them as mirrors to bewilder the enemy. it transforms into its beast mode by rearranging its transparent panels, and attacks the enemy.its special moves are crushing the enemy with its gigantic hands (beat press), unleashing an electric attack from its antennae (hexa-thunder), and throwing the panel-shaped energy in its hands to slash the enemy (cutting edge).  misc"
Eosmon_(Ultimate),https://wikimon.net/Eosmon_(Ultimate),https://wikimon.net/File:Eosmon_ultimate.jpg,Eosmon_ultimate.jpg,"an ultimate-level eosmon that was born after several of the eosmon that were created formed a single collective entity as a result of a researcher losing control when things didn't go as planned. it will destroy any obstacle, and act violently just as instructed. it is able to generate new perfect-level eosmon from its swollen tail, increasing its subordinates.its special moves are a beam fired from its chest (aurora stream), slashing the enemy by teleporting (cutting edge), and enlarging the panels that it protects itself with, causing them to rain down over the enemy, crushing them (cruelty rain).  misc"
Espimon,https://wikimon.net/Espimon,https://wikimon.net/File:Espimon.jpg,Espimon.jpg,"a cyborg digimon that immediately flies in to investigate whenever it catches wind of gossip and suspicion flowing into the digital world. it will bravely infiltrate places in order to find out the truth, even if they are inhabited by dangerous digimon. when it switches its eyes to search mode, it is able to clearly see objects several kilometers away. also, it activates its ""divanish"", which applies an optical camouflage to its body, by pressing the switch on its abdomen, and blends in with its surroundings, allowing it to perform reconnaissance without being discovered. its signature move is the self-propulsive, timed ""mot bomb"", which it uses depending on the situation, such as attacking the enemy or making a decoy. rumor has it that the crack team measures their cracking ability by controlling espimon, but it is unclear whether this is true or not.   video games"
Etemon,https://wikimon.net/Etemon,https://wikimon.net/File:Etemon.jpg,Etemon.jpg,"an unidentified digimon that suddenly appeared in the digital world. it calls itself the ""king of digimon"", and its fighting strength is beyond imagination. and, well, it's rumored that it pulls the strings of the mysterious digimon ""monzaemon"". it is dressed in its reinforced saru suit which can endure every attack, and even today it bustles about the whole world for the sake of its unending battles. its special move is breaking the opponent's heart and making their fighting spirit vanish (love serenade), and a dark sphere that consumes everything it touches (dark spirits).  virtual pets  video games"
Evilmon,https://wikimon.net/Evilmon,https://wikimon.net/File:Evilmon.jpg,Evilmon.jpg,"a small devil digimon that abhors losing. for that reason it is a coward that torments the weak with pricks, without getting into direct combat. it seems it is credited as being the source of the dark-species digimon that inhabit the dark area, but there are still many mysteries. its special move is subjecting you to a nightmare that you can't wake up from using a supersonic wave it emits from its mouth (nightmare shock).  virtual pets"
Ex-Tyranomon,https://wikimon.net/Ex-Tyranomon,https://wikimon.net/File:Extyranomon.jpg,Extyranomon.jpg,"a puppet digimon that sneaks around within a tyranomon-shaped plush toy. the reason why it is a tyranomon plush toy is unclear, but it is likely that the mysterious digimon that is stealing away inside just broke into the plush toy that was closest. however, this plush toy possesses power rivaling that of monzaemon at its limits and the defensive power of an impregnable fortress, so ordinary digimon and the like are completely unable to oppose it. however, like monzaemon, if nothing is pulling its strings, then it is nothing but an ornament. its special moves are ""pretty attack"", which emanates from its adorable body, and an evil orb unleashed by the digimon hiding within it (black matter).  virtual pets  video games"
Examon,https://wikimon.net/Examon,https://wikimon.net/File:Examon.jpg,Examon.jpg,"a holy knight digimon which is one of the digital world's sacred guardians, the ""royal knights"". as it is a digimon which possesses an extraordinary data size, traditional digital tools were unable to completely render it, and its existence was discovered because it finally became possible to render it with the use of state-of-the-art digital tools. though it belongs to the royal knights, it is simultaneously a being which stands at the top of all dragon digimon, and holds the alias of ""dragon emperor"". it possesses the gigantic, sentient wings ""caledfwlch"" and the gigantic lance ""ambrosius"". the caledfwlch is a unique set of wings composed entirely of chrome digizoid, and at caledfwlch's own will, it can at times change into wings for flight, or into a shield which defends examon. the lance ""ambrosius"" is loaded with special shells stocked with viruses which possess various effects, so examon's attacks are quite diverse. its special moves are stabbing the opponent with the ambrosius and exploding all of its special shells, annihilating them from within (avalon's gate), and rocketing up to the exosphere and conducting a high-powered laser firing (pendragon's glory). also, its ""dragonic impact"", in which it dives from the exosphere and performs a ramming attack shrouded in heat from friction with the atmosphere, mops up swaths of enemies with its accompanying shock wave.  digimon life"
Examon_(X-Antibody),https://wikimon.net/Examon_(X-Antibody),https://wikimon.net/File:Examonx.jpg,Examonx.jpg,"a holy knight digimon which is one of the digital world's sacred guardians, the ""royal knights"". as it is a digimon which possesses an extraordinary data size, traditional digital tools were unable to completely render it, and its existence was discovered because it finally became possible to render it with the use of state-of-the-art digital tools. though it belongs to the royal knights, it is simultaneously a being which stands at the top of all dragon digimon, and holds the alias of ""dragon emperor"". it possesses the gigantic, sentient wings ""caledfwlch"" and the gigantic lance ""ambrosius"". the caledfwlch is a unique set of wings composed entirely of chrome digizoid, and at caledfwlch's own will, it can at times change into wings for flight, or into a shield which defends examon. the lance ""ambrosius"" is loaded with special shells stocked with viruses which possess various effects, so examon's attacks are quite diverse. its special moves are stabbing the opponent with the ambrosius and exploding all of its special shells, annihilating them from within (avalon's gate), and rocketing up to the exosphere and conducting a high-powered laser firing (pendragon's glory). also, its ""dragonic impact"", in which it dives from the exosphere and performs a ramming attack shrouded in heat from friction with the atmosphere, mops up swaths of enemies with its accompanying shock wave.the effect on examon's digicore due to the x-antibodyits holy knight data has been drawn out, so it appears like a knight wearing a helmet and armor. it is overflowing with dragon and holy knight power which swirls around it, creating dragonic plasma. it manifests twelve ""raiken bureiragaha"" from the lightning that falls from its dragonic plasma, and fires them at the enemy. its high-energy emitting ""kyukyoku senryusou ambrosius"" is sentient, and the amount of energy it releases varies depending on how strong the opponent is. no enemy can withstand its special move ""pendragon sparkle"", in which it impales them with its fully unleashed ""kyukyoku senryusou ambrosius"", and looses large thunderbolts from its dragonic plasma.  misc"
