name,full_page_wiki_url,image_url,image_filename,description
Leomon,https://wikimon.net/Leomon,https://wikimon.net/File:Leomon.jpg,Leomon.jpg,"a beast man digimon which is called the ""king of beasts"", as well as the ""noble hero"". while most digimon are savage, it possesses a strong purpose and a heart of justice, and has defeated a great number of fiendish digimon. also, it is a rival to the ""digimon hunter"" orgemon, who runs the whole gamut of destruction. its tough flesh, tempered well by daily training, can endure any attack, and it chokes the life out of the opponent with its ultimate secret technique, its special move ""juouken"". it carries a sentient magical sword named ""shishiou-maru"" on its waist.  digimon life virtual pets  video games"
Leomon_(X-Antibody),https://wikimon.net/Leomon_(X-Antibody),https://wikimon.net/File:Leomonx.jpg,Leomonx.jpg,"a beast man digimon which is called the ""king of beasts"", as well as the ""noble hero"". while most digimon are savage, it possesses a strong purpose and a heart of justice, and has defeated a great number of fiendish digimon. also, it is a rival to the ""digimon hunter"" orgemon, who runs the whole gamut of destruction. its tough flesh, tempered well by daily training, can endure any attack, and with the ultimate mystery of its special move ""juouken"", it chokes the life out of the opponent. it carries a sentient magical sword called ""shishiou-maru"" on its waist.the effect on leomon's digicore due to the x-antibodyin order to defeat more fiendish digimon to enforce its justice, it has mastered swordsmanship through intense training in addition to physical training. it freely handles the longsword ""juga-maru"" and the magical sword ""shishiou-maru"", which are said to have sharpened more through countless battles, by dual wielding them, so it is definitely a ""beast gladiator"". since its red cape was obtained when it confronted an ultimate digimon, it is said to be the proof of a hero.  digimon life misc"
Leviamon,https://wikimon.net/Leviamon,https://wikimon.net/File:Leviamon.jpg,Leviamon.jpg,"the strongest monster existing in the digital world, it is called the ""devil beast"" out of terror of the exceedingly mighty power that this monster possesses and is counted as one of the ""seven great demon lords"". this extensive monster, said to possess gigantic jaws which could guzzle down even the digital world, is reported to sleep in the depths of the net ocean nearest to the dark area, and if it is awakened, it will despise any digimon at the top, and will cause other demon lord digimon and even angel digimon to run away in fear. however, as the existence of the limits on digimon are decoded, its own appears similar to nothingness, and it is said that it builds the foundation for the existence of wickedness in the digital world. its special moves are destroying everything with its gigantic jaws (rostrum), and mowing everything down with its long tails (cauda).  digimon life virtual pets current original"
Leviamon_(X-Antibody),https://wikimon.net/Leviamon_(X-Antibody),https://wikimon.net/File:Leviamonx.jpg,Leviamonx.jpg,"the strongest monster existing in the digital world, it is called the ""devil beast"" out of terror of the exceedingly mighty power that this monster possesses and is counted as one of the ""seven great demon lords"". this extensive monster, said to possess gigantic jaws which could guzzle down even the digital world, is reported to sleep in the depths of the net ocean nearest to the dark area, and if it is awakened, it will despise any digimon at the top, and will cause other demon lord digimon and even angel digimon to run away in fear. however, as the existence of the limits on digimon are decoded, its own appears similar to nothingness, and it is said that it builds the foundation for the existence of wickedness in the digital world. its special moves are destroying everything with its gigantic jaws (rostrum), and mowing everything down with its long tails (cauda).the effect on leviamon's digicore due to the x-antibodywing-arms grow from its back, and it gained the ability to fly by spurting out excess energy. land, sea, and air have become feeding grounds for leviamon where it will try to devour everything. its special moves are skewering the enemy with its tentacle-shaped tails all at once (cauda mortifera), and crunching them with its three split jaws (rostrum triadens). also, when the envy energy contained within leviamon reaches its peak and the crown of envy shines, it unleashes extremely intense lightning from its three horns (seventh lightning), which is said to sink continents into the ocean.  misc"
Liamon,https://wikimon.net/Liamon,https://wikimon.net/File:Liamon.jpg,Liamon.jpg,"a holy beast digimon that exudes the style of a ""king"", even though it is only an adult. it is said to be a digimon that evolved from liollmon, but there are even fewer surviving individuals than those of liollmon, so its existence is becoming an ""illusion"". it tends to prefer capturing prey that is stronger than itself, and it has often been observed commencing an attack against an ultimate digimon without even flinching. its special moves are charging and then releasing electricity generated in its mane (thunder of king), and reliably aiming at the opponent's vitals with its fangs (critical strike).  digimon life virtual pets misc"
Lianpumon,https://wikimon.net/Lianpumon,https://wikimon.net/File:Lianpumon_new_century.png,Lianpumon_new_century.png,"a mutation digimon that wears a distinctive mask. it has a cheerful personality and loves the lively atmosphere of temple festivals, and will keep changing various masks to try to liven up the mood. the moment a mask is removed, another mask will immediately emerge from beneath, so no one has seen its true face behind the mask.in addition, lianpumon hardly ever speaks, but will use posture, gestures and changing masks to express its emotions instead of words. it is rumored that all of the masks made by lianpumon resemble the appearance of digimon with whom it is close, and are concealed within its cape.in battle, it will change masks to use various abilities and display specialized tactics.its expressionless mask ""tie bi xiang"" drastically raises its defensive power, and its body becomes as hard as rock. when an ally is injured, it puts on its ""xianshen xiang"", a mask that shows a loving expression. it can share its own data with its companions and quickly heal the wounds it touches.digimon new century"
Lighdramon,https://wikimon.net/Lighdramon,https://wikimon.net/File:Lighdramon.jpg,Lighdramon.jpg,"an armor-level beast digimon that evolved through the power of the ""digimental of friendship"". the ""digimental of friendship"" has the attribute of ""thunder"", and those that don this digimental fight against their enemies with nimble movements like lightning piercing the ground, and defeat them with electric-based techniques. its special moves are firing an electric blade from the lightning-imbued blade on its head (lightning blade), and unleashing a powerful electric shock from the three protuberances on its back (blue thunder).  digimon life virtual pets  misc"
Lilamon,https://wikimon.net/Lilamon,https://wikimon.net/File:Lilamon.jpg,Lilamon.jpg,"a fairy digimon which has an appearance like the lilac, a flower that is loved by everyone. it is pure and innocent, and despite its beautiful appearance, it is said to govern over death and rebirth. its leaves are toxic, and are enough to bring death to the opponent. its special moves are firing countless slender beams from its leaf-like fingers (lila shower), and continuously slapping with its extensible hands (beauty slap). in addition, it is said that those who suffer this technique instantly fall in love with lilamon. also, it can dance gracefully, scattering lovely-smelling pollen to bewitch the opponent (un deux pollen).  digimon life virtual pets  video games"
Lilimon,https://wikimon.net/Lilimon,https://wikimon.net/File:Lilimon.jpg,Lilimon.jpg,"a fairy digimon born from beautifully blooming flower petals. although it looks like it has an appearance like a human child, it is a perfect digimon hiding unfathomable power within. due to its whimsical, tomboyish personality, it is said that it will open its heart to a human girl with a similar temperament. also, because it becomes unable to settle down if it starts crying like a crybaby, a great effort is necessary to win it over. however, it also has an aspect that kindly extends its hand to small or weak things. it can fly in the air with the four leaf-like wings growing from its back, and it is said that after lilimon flies by, a fresh breeze will blow. its special move is thrusting both of its arms forward, making a gun muzzle from the petals on its wrists, and shooting an energy shell (flow' cannon).  digimon life virtual pets  video games"
Lilimon_(X-Antibody),https://wikimon.net/Lilimon_(X-Antibody),https://wikimon.net/File:Lilimonx.jpg,Lilimonx.jpg,"a fairy digimon born from beautifully blooming flower petals. although it looks like it has an appearance like a human child, it is a perfect digimon hiding unfathomable power within. due to its whimsical, tomboyish personality, it is said that it will open its heart to a human girl with a similar temperament. also, because it becomes unable to settle down if it starts crying like a crybaby, a great effort is necessary to win it over. personality-wise, it also has an aspect that kindly extends its hand to small or weak things. it can fly in the air with the four leaf-like wings growing from its back, and it is said that after lilimon flies by, a fresh breeze will blow. its special move is thrusting both of its arms forward, making a gun muzzle from the petals on its wrists, and shooting an energy shell (flow' cannon).the effect on lilimon's digicore due to the x-antibodyduring direct confrontation with lilimon, the enemy digimon will be greeted lightheartedly regardless how horrible they are; even if they threaten it, they will be lightly dismissed. however, it occasionally ignores them, and it is said that those ignored digimon are the ones surprised instead. its whimsical, tomboyish personality has been accelerated, and although it does not look scary, it has in a sense become the strongest digimon around. it beautifully adorns itself with a tiara and ribbons because it knows it can be the best of itself, but when it starts crying, it indiscriminately unleashes its ""sleepy bud"", where it kicks frantically with both legs while throwing a tantrum, absolutely powering up its selfishness as well.  digimon life misc"
Lilithmon,https://wikimon.net/Lilithmon,https://wikimon.net/File:Lilithmon.jpg,Lilithmon.jpg,"as a demon lord digimon which has the appearance of a woman, it is one of the ""seven great demon lords"". it is thought that it was originally the same kind of digimon as ofanimon, but it fell from heaven and eventually became known as the ""goddess of darkness"". it confounds its opponents with its bewitchingly lovely appearance, and it is said that those who are taken in by its temptations are invariably granted death. its reputation as the ""goddess of darkness"" is appropriate, as it offers generosity towards vice, but only cruel outrages towards virtue. the demonic ""nazar nail"" on its right arm corrodes everything it touches. its special move is rotting the opponent's body with a sigh of darkness (phantom pain). it is said that if one is struck by this curse, their data dissipates from the tips of their body and they suffer pain even in death.  digimon life virtual pets"
Lilithmon_(X-Antibody),https://wikimon.net/Lilithmon_(X-Antibody),https://wikimon.net/File:Lilithmonx.jpg,Lilithmonx.jpg,"as a demon lord digimon which has the appearance of a woman, it is one of the ""seven great demon lords"". it is thought that it was originally the same kind of digimon as ofanimon, but it fell from heaven and eventually became known as the ""goddess of darkness"". it confounds its opponents with its bewitchingly lovely appearance, and it is said that those who are taken in by its temptations are invariably granted death. its reputation as the ""goddess of darkness"" is appropriate, as it offers generosity towards vice, but only cruel outrages towards virtue. the demonic ""nazar nail"" on its right arm corrodes everything it touches. its special move is rotting the opponent's body with a sigh of darkness (phantom pain). it is said that if one is struck by this curse, their data dissipates from the tips of their body and they suffer pain even in death.the effect on lilithmon's digicore due to the x-antibodyhaving x-evolved because of its obsession for beauty, lilithmon obtained a young, bewitching body. it is said that its appearance captivates everyone who sees it, instantly turning them into its puppets. lilithmon, who achieved ultimate beauty, has turned into a luscious, baleful goddess of death due to its generous capacity. its special move is drawing out power from the crown of lust to control others over a vast range (seventh fascinate). digimon that have turned into its puppets have their power drawn out beyond their limits, leading to their death after being controlled. lilithmon itself watches with pleasure as their lights shine and fade away in their last moments.  misc"
Liollmon,https://wikimon.net/Liollmon,https://wikimon.net/File:Liollmon.jpg,Liollmon.jpg,"a holy beast digimon which has a golden coat. there seems to be very few surviving individuals, so its existence was not confirmed until recently. it is a digimon with very intense territoriality, so it doesn't show mercy to those who enter its territory, even if they are the same species of digimon. when it is on alert, the hair on its head becomes tinged with static electricity, and it is said that it produces a sound when threatened. its special moves are cutting the opponent to pieces with its sharp claws (lio claw), and aiming at the opponent's vitals with its fangs (critical bite). although ""critical bite"" has the explosive power to take down even adult digimon with a single blow, its success rate is low.  digimon life virtual pets misc"
Loader_Leomon,https://wikimon.net/Loader_Leomon,https://wikimon.net/File:Loaderliomon.jpg,Loaderliomon.jpg,"a machine digimon that was produced when cad data for construction machinery leaked onto its server, then fused with the configuration data of a beast digimon. its mane has become a pneumatic drill, and it works primarily in tunnel construction and in the chrondigizoit mines. the chrondigizoit mines are often surrounded by a solid layer of bedrock, so it boasts both power and stamina, as well as top-class performance among machine digimon. there are many loader leomon with a stubborn personality due to their pride in their work, but there are many people with the viewpoint that states, ""loader leomon is just quarrelsome."" it seems that one mine, which had the best deposits in the world, was blown away by a fight between loader leomon. its special moves are an attack produced by the extremely high-speed rotation of its mane (boring storm), and striking with the iron sphere on its tail (loader morning star).  digimon life virtual petscurrent original"
Locomon,https://wikimon.net/Locomon,https://wikimon.net/File:Locomon2.jpg,Locomon2.jpg,"a machine digimon which has the appearance of a steam locomotive, its purpose in life is to keep running. it is a being which transports the data within the network across the digital world. within the digital world, where a large quantity of information comes and goes, the meaning of life for locomon and other vehicle-species digimon is in how quickly they can convey that information. however, there are times when old models of locomon have run completely wild as a result of seeking to go too quickly. also, although its range of movement is confined because it can only run on rails, there are occasions when it has generated spatial distortions by continuously running in circles. its signature move, ""steam bomb"", is using bombs of the steam blowing from its smokestack. its special move is spinning and then throwing spiked wheels (wheel grinder).  digimon life"
Loogamon,https://wikimon.net/Loogamon,https://wikimon.net/File:Loogamon.jpg,Loogamon.jpg,"a demon beast digimon that is, because of the outdated interface on its brow, presumed to be an experimental ""prototype digimon"" from before digimon were discovered. it is said that the data of the warg from real-world mythology is embedded within the deepest parts of its digicore, and it exhibits behavior so violent that you would not expect it from a child. at first glance, it looks like a cute puppy, but if one approaches it carelessly, they will be on the receiving end of a fierce counterattack. it has a trait of recognizing those who can control it as its master, and despite being difficult to tame, it can become a reliable companion if one is able to build a trustful relationship with it. its special moves are shooting flames imbued with magical power from its mouth (howling fire), and biting with its sharp fangs as it spins (spiral bite).  misc"
Lopmon,https://wikimon.net/Lopmon,https://wikimon.net/File:Lopmon.jpg,Lopmon.jpg,"an extremely precious twin digimon child. terriermon is the one with one horn growing from its head, while lopmon is the one with three horns growing from its head. the way it grows is shrouded in mystery, and though it can be classified as a beast-species digimon from its body structure, aside from that it is still not understood. terriermon has a calm personality, but is very robust. in contrast, lopmon has the personality of a lonely crybaby. neither of them seem like ""combat species"" digimon, but when battling, they show that they are more powerful than they appear. its signature moves are generating a tiny tornado by spinning its ears like a propeller (petit twister), and its unison technique ""double typhoon"". its special move is spitting out shots of supercooled air (blazing ice).  digimon life"
Lopmon_(X-Antibody),https://wikimon.net/Lopmon_(X-Antibody),https://wikimon.net/File:Lopmonx.jpg,Lopmonx.jpg,"an extremely precious twin digimon child. terriermon is the one with one horn growing from its head, while lopmon is the one with three horns growing from its head. the way it grows is shrouded in mystery, and though it can be classified as a beast-species digimon from its body structure, aside from that it is still not understood. terriermon has a calm personality, but is very robust. in contrast, lopmon has the personality of a lonely crybaby. neither of them seem like ""combat species"" digimon, but when battling, they show that they are more powerful than they appear. its signature moves are generating a tiny tornado by spinning its ears like a propeller (petit twister), and its unison technique ""double typhoon"". its special move is spitting out shots of supercooled air (blazing ice).the effect on lopmon's digicore due to the x-antibodyits ear hair and tail are lighter and more buoyant than air, allowing it to float gently before the wind. the ""chen garnet"" ear jewelry is linked to its twin, terriermon, allowing them to know each other's status at all times. it enjoys taking a stroll in the air with terriermon, whom it adores, more than anything else. its special move is a unison technique where it inhales air at the exact same time as terriermon and expels it as hot and cold air (fi-rost typhoon).  misc"
Lord_Knightmon,https://wikimon.net/Lord_Knightmon,https://wikimon.net/File:Lordknightmon.jpg,Lordknightmon.jpg,"a holy knight digimon which is the monarch which presides over all knightmon and is one of the ""royal knights"". more than morality, lord knightmon is faithful to what it personally regards as ""justice"", and that end justifies their means. if it will bring about lasting peace, lord knightmon will find merit there, even with ""rule by power"". in its entirety, it has unparalleled ruthlessness in the execution of its duties, and it shows no compassion for the weak. its special moves are chopping up the opponent with the four sash-blades that extend from its armor (spiral masquerade), and instantly coming into point-blank range, shooting the opponent in the chest with shock waves from the pile bunker on its right arm (urgent fear).  digimon life"
Lotusmon,https://wikimon.net/Lotusmon,https://wikimon.net/File:Lotusmon.jpg,Lotusmon.jpg,"a fairy digimon that has an appearance like the lotus, which is said to be a flower that blooms in heaven. its personality is lady-like in its calmness and grace, and it possesses the abilities of making people forget the suffering of this sad world and granting them good dreams. however, it will bring down its grand hammer on those that refuse that good will. its special moves are released from the caduceus, which is held in its left hand and administers restoration and devastation, as a white aura (serpent cure), and a black aura (serpent ruin). also, a seven-colored aura is released from the staff of rainbow-colored flowers that is held in its right hand (seven's fantasia), and this makes the opponent completely lose its fighting spirit by tempting it into a euphoric fantasy world.  digimon life"
Lovely_Angemon,https://wikimon.net/Lovely_Angemon,https://wikimon.net/File:Lovelyangemon.jpg,Lovelyangemon.jpg,"a close combat specialist renowned for being an angel that descended to earth. it is always bright and cheerful, and adorns itself in a fashionable manner, and has a lovely personality that enjoys eating delicious things while walking about. however, lovely angemon contains the data of magical fighters who engage in hand-to-hand combat, and deals fiendish enemies that it can never forgive with a breathtaking combo of combat techniques. no matter what sort of crisis arises, it will overcome the predicament with its spirit of never giving up, and achieve victory at any cost.its special moves are putting all its strength into its fist and dishing out a seven-colored punch (marble impact), and jumping high into the sky and kicking while spinning (dream hurricane). in addition, its ""lovely shower"", where it punches its fist and fires heart-shaped energy shots at the enemy, has the effect of purifying the enemy's evil heart."
Löwemon,https://wikimon.net/Löwemon,https://wikimon.net/File:Lowemon2.jpg,Lowemon2.jpg,"a digimon that truly inherited the ""spirit of darkness"" of the legendary ten warriors. the ""spirit of darkness"" was changed into its duskmon form due to cherubimon's spell, but lowemon is its true form released from this magical power. this form is by no means a baleful one, and is called the battling ""valiant jet-black warrior"" that becomes the shadow of the other ten warriors. even on its own, its power is comparable to ""fusion-species"" like aldamon, and it is said that it conceals its power that puts the others to shame within the ""neebelnge ring"" placed on its right index finger. as a master of spearmanship, it is an ""executor of darkness"" that pierces evil with the ""danzai no yari"", and purifies it with the ""shokuzai no tate"". its special moves are blasting the opponent with an intense spear attack (ewig schlaf), and firing a golden energy wave from the lion on its chest (endlich meteor).  digimon life"
Lucemon,https://wikimon.net/Lucemon,https://wikimon.net/File:Lucemon2.jpg,Lucemon2.jpg,"said to have descended to the ancient digital world long ago, it is an angel digimon which has the appearance of a child. it manifested in an era in which the digital world was still chaotic, and it is said that it brought about order and harmony. however, a long period of darkness was summoned due to lucemon's later ""rebellion"". although it has the appearance of a child, the power and intelligence it possesses surpass even that of a perfect digimon. it is said that lucemon's abilities have now been inherited and split among the three archangels. its special move is firing ten super-heated spheres of light arranged in a cruciform syzygy (grand cross). this technique possesses a power surpassing that of seraphimon's ""seven heavens"".  digimon life  video games"
